{
  "activation": {
    "reasonCodes": [
      "BILLING_ASSOCIATION_PENDING",
      "FOUNDATION_NOT_APPLIED",
      "OPERATOR_LEASE_MISSING",
      "PULL_SECRET_MISSING",
      "ENTITLEMENT_OBSERVATION_MISSING",
      "LINUX_INSTALLER_EXECUTION_MISSING",
      "SOURCE_ADMISSION_INCOMPLETE",
      "TRIAL_CHART_PROFILES_MISSING",
      "TRIAL_DEPENDENCY_RUNTIME_CONTRACT_REFRESH_PENDING",
      "TRIAL_DEPENDENCY_MANIFEST_REFRESH_PENDING",
      "DESTINATION_PULL_PROOF_MISSING",
      "SECRET_REFERENCES_UNRESOLVED",
      "TLS_REFERENCES_UNRESOLVED",
      "LIVE_ALLOCATABLE_NOT_OBSERVED",
      "CAPACITY_CALIBRATION_PENDING",
      "SERVER_SIDE_DRY_RUN_MISSING"
    ],
    "state": "blocked"
  },
  "architecture": "linux/amd64",
  "bindings": {
    "artifactReleaseSetDigest": "sha256:4f571fade2a1566a53d797c82561f30292734fcfcc75b23667dc08007ee8b6fe",
    "dependencyArtifactSetDigest": "sha256:b59db076514f87b1251d069e5637badc21940aaf9cb729f49ab17f0058b4a46e",
    "dependencySourceDigest": "sha256:73282faf172793398120509087930691e362f2290d4b60cc7f13ef4f99bf4219",
    "labServicesDigest": "sha256:bcb33ebb8ff8d539780ed4fdfb728196744832491e5aa61ad714613d968a290e",
    "toolchainLockDigest": "sha256:c9ace01bc3d0c6e0dd9f404b2781ed70c8f82e01ced3bff431eca316649e0c9d",
    "trialProfileDigest": "sha256:9a7dbdac36417b10ce15b74de4558502fc09cf1740153c5817b89df4c0ba738a"
  },
  "candidateDigest": "sha256:03427f83b8131b515e93733524d4f31a857ccba411ab0ca9144f9eda19073f81",
  "candidateId": "orchestra-sno-trial-workload-candidate-2026-07-28.2",
  "claims": {
    "campaignEvidence": false,
    "contractualSla": false,
    "customerCertified": false,
    "highAvailability": false,
    "productionSupported": false,
    "redHatCertified": false,
    "referenceProfileVerified": false,
    "rpoRtoVerified": false
  },
  "controls": {
    "activationAuthorized": false,
    "allowedCertificationSlots": [],
    "argocdApplicationsEmitted": false,
    "autoscalingEnabled": false,
    "backupMode": "none-ephemeral-trial",
    "campaignEligible": false,
    "cloudMutationAuthorized": false,
    "installAuthorized": false,
    "kustomizationReferenced": false,
    "manifestsEmitted": false,
    "platformInSynchronousRuntimePath": false,
    "platformProductionToolExecution": false,
    "podDisruptionBudgetsEnabled": false,
    "profileScope": "sno-engineering-trial-only",
    "registryMode": "direct-source-by-digest-after-review",
    "replicaPolicy": "single-replica-no-ha",
    "runtimeMcpMode": "read-only",
    "secretStrategy": "operator-created-existing-secret-references",
    "secretValuesStored": false,
    "tlsStrategy": "operator-provided-trial-secret-references",
    "topologySpreadEnabled": false
  },
  "executionMode": "source-only",
  "kind": "orchestra.openshift.sno-trial-workload-candidate.v1",
  "nodeEnvelope": {
    "aggregateLimits": {
      "cpuMillicores": 7250,
      "memoryMiB": 25600
    },
    "machineType": "n2-standard-8",
    "peakRequests": {
      "cpuMillicores": 3650,
      "memoryMiB": 14976
    },
    "persistentVolumeGiB": 48,
    "physical": {
      "cpuMillicores": 8000,
      "memoryMiB": 32768
    },
    "requestHeadroom": {
      "cpuMillicores": 1350,
      "memoryMiB": 5504
    },
    "steadyRequests": {
      "cpuMillicores": 3400,
      "memoryMiB": 14720
    },
    "systemReserve": {
      "cpuMillicores": 3000,
      "memoryMiB": 12288
    },
    "transientPeakAllowance": {
      "cpuMillicores": 250,
      "memoryMiB": 256,
      "scheduling": "serial-only"
    },
    "workloadRequestBudget": {
      "cpuMillicores": 5000,
      "memoryMiB": 20480
    }
  },
  "profileId": "orchestra-ocp-sno-trial-amd64-v1",
  "schemaVersion": 1,
  "targetClass": "engineering-trial",
  "workloads": [
    {
      "artifact": {
        "admissionState": "published-not-trial-admitted",
        "platformDigest": "sha256:377c03cc1379c27e5a3120931a4772a50f361861d5564987345c64b69b6e13c2",
        "reference": "ghcr.io/caglarsubas/agent-hook-v2/prometa-ubi@sha256:377c03cc1379c27e5a3120931a4772a50f361861d5564987345c64b69b6e13c2",
        "sourceClass": "cross-plane-release",
        "sourceId": "platform",
        "usableForCapacityOnly": true
      },
      "category": "product",
      "id": "platform",
      "mode": {
        "agentQuerying": false,
        "observeFirst": true,
        "orchestrationRun": false,
        "toolExecution": false
      },
      "persistentVolumeGiB": 0,
      "replicas": 1,
      "resources": {
        "limits": {
          "cpuMillicores": 1000,
          "memoryMiB": 1024
        },
        "requests": {
          "cpuMillicores": 250,
          "memoryMiB": 512
        }
      }
    },
    {
      "artifact": {
        "admissionState": "published-not-trial-admitted",
        "platformDigest": "sha256:09675478f3c45a636106df6a8e943ae0132d39c3fa814798a7470a8d84f11144",
        "reference": "ghcr.io/prometa-ai/orchestra-python-sdk/prometa-runtime-host-ubi9@sha256:09675478f3c45a636106df6a8e943ae0132d39c3fa814798a7470a8d84f11144",
        "sourceClass": "cross-plane-release",
        "sourceId": "runtimeHost",
        "usableForCapacityOnly": true
      },
      "category": "product",
      "id": "runtime-host",
      "mode": {
        "mcp": "read-only",
        "modelCalls": true,
        "productionHostedByPlatform": false,
        "writeTools": false
      },
      "persistentVolumeGiB": 0,
      "replicas": 1,
      "resources": {
        "limits": {
          "cpuMillicores": 500,
          "memoryMiB": 512
        },
        "requests": {
          "cpuMillicores": 100,
          "memoryMiB": 128
        }
      }
    },
    {
      "artifact": {
        "admissionState": "published-not-trial-admitted",
        "platformDigest": "sha256:55d7b099ef7400c0ef62d40be1eb3865726ac45f5258a7cc177c4173af8b2bfb",
        "reference": "ghcr.io/caglarsubas/llm_inference_engine/inference-engine-ubi@sha256:55d7b099ef7400c0ef62d40be1eb3865726ac45f5258a7cc177c4173af8b2bfb",
        "sourceClass": "cross-plane-release",
        "sourceId": "modelPlane",
        "usableForCapacityOnly": true
      },
      "category": "product",
      "id": "model-plane",
      "mode": {
        "backend": "remote-in-cluster",
        "fallbackRequired": true,
        "rateLimitScope": "deployment-shared",
        "routingPolicyRequired": true
      },
      "persistentVolumeGiB": 1,
      "replicas": 1,
      "resources": {
        "limits": {
          "cpuMillicores": 1500,
          "memoryMiB": 8192
        },
        "requests": {
          "cpuMillicores": 500,
          "memoryMiB": 4096
        }
      }
    },
    {
      "artifact": {
        "admissionState": "source-resolved-not-mirrored",
        "platformDigest": "sha256:dea92d39d38abf4d87c0b0bd43cbf956dc2de03db3a78b5829ac629ef296b8e1",
        "reference": "ghcr.io/cloudnative-pg/postgresql:16.10-system-trixie",
        "sourceClass": "dependency-source",
        "sourceId": "cloudnative-pg-postgresql-16",
        "usableForCapacityOnly": true
      },
      "category": "dependency",
      "id": "postgresql",
      "mode": {
        "backup": false,
        "highAvailability": false,
        "implementation": "trial-direct-single-instance",
        "logicalDatabases": 2
      },
      "persistentVolumeGiB": 10,
      "replicas": 1,
      "resources": {
        "limits": {
          "cpuMillicores": 500,
          "memoryMiB": 2048
        },
        "requests": {
          "cpuMillicores": 250,
          "memoryMiB": 1024
        }
      }
    },
    {
      "artifact": {
        "admissionState": "source-resolved-not-mirrored",
        "platformDigest": "sha256:cb75da0e596b8115d10bea34cef1414eafebfbcb5f5136c03e022c7b525899b3",
        "reference": "docker.io/clickhouse/clickhouse-server:25.8.28.1",
        "sourceClass": "dependency-source",
        "sourceId": "clickhouse-server-lts",
        "usableForCapacityOnly": true
      },
      "category": "dependency",
      "id": "clickhouse",
      "mode": {
        "backup": false,
        "highAvailability": false,
        "implementation": "trial-direct-single-instance",
        "keeper": false
      },
      "persistentVolumeGiB": 20,
      "replicas": 1,
      "resources": {
        "limits": {
          "cpuMillicores": 1000,
          "memoryMiB": 4096
        },
        "requests": {
          "cpuMillicores": 500,
          "memoryMiB": 2048
        }
      }
    },
    {
      "artifact": {
        "admissionState": "source-resolved-not-mirrored",
        "platformDigest": "sha256:8c0cf827d557b41c5973875a2618eb886aa26d20921471f03ed1185702ad1cf2",
        "reference": "docker.io/library/nats:2.14.2-alpine",
        "sourceClass": "dependency-source",
        "sourceId": "nats-server",
        "usableForCapacityOnly": true
      },
      "category": "dependency",
      "id": "jetstream",
      "mode": {
        "durableTelemetry": true,
        "highAvailability": false,
        "implementation": "trial-direct-single-instance",
        "streamReplicas": 1
      },
      "persistentVolumeGiB": 5,
      "replicas": 1,
      "resources": {
        "limits": {
          "cpuMillicores": 250,
          "memoryMiB": 512
        },
        "requests": {
          "cpuMillicores": 100,
          "memoryMiB": 256
        }
      }
    },
    {
      "artifact": {
        "admissionState": "source-resolved-not-mirrored",
        "platformDigest": "sha256:64f6e8025b9a798061c8c79e73a7a79dbc8cca437e6af682e9f7605ff334615d",
        "reference": "docker.io/valkey/valkey@sha256:64f6e8025b9a798061c8c79e73a7a79dbc8cca437e6af682e9f7605ff334615d",
        "sourceClass": "trial-dependency-artifact",
        "sourceId": "valkey-image",
        "usableForCapacityOnly": true
      },
      "category": "dependency",
      "id": "valkey",
      "mode": {
        "aof": true,
        "highAvailability": false,
        "implementation": "trial-direct-single-instance",
        "sentinel": false
      },